{
  "schemaVersion": 1,
  "protocolVersion": 1,
  "executionId": "exec-ad65660d-9849-46d5-b855-5740652ef4d8",
  "taskId": "poc-real-protocol-execution-20260826",
  "checkId": "test-suite",
  "requirement": "tests",
  "verificationCycle": 1,
  "kind": "COMMAND_EXECUTION",
  "argv": [
    "node",
    "--test",
    "poc/workload/test/evaluator.test.js",
    "poc/workload/test/cli.test.js"
  ],
  "cwd": "/Users/cassio/Documents/github/forgeloop",
  "resolution": {
    "resolutionMode": "LOCAL_EXECUTABLE",
    "mayInstall": false,
    "installer": null,
    "tool": null
  },
  "startedAt": "2026-08-26T18:01:17.628Z",
  "finishedAt": "2026-08-26T18:01:18.052Z",
  "status": "passed",
  "exitCode": 0,
  "durationMs": 424,
  "termination": "exit",
  "signal": null,
  "stdoutSha256": "f87e77117f5647cf378245e4b2791e3c39f44540fe3e965b5af55a111ce361d2",
  "stderrSha256": "e3b0c44298fc1c149afbf4c8996fb92427ae41e4649b934ca495991b7852b855",
  "stdoutBytes": 1848,
  "stderrBytes": 0,
  "outputTruncated": false
}
