{
  "schemaVersion": 1,
  "protocolVersion": 1,
  "executionId": "exec-52c080e5-1310-4c49-9b32-35e4ea57d243",
  "taskId": "poc-real-protocol-execution-20260826",
  "checkId": "audit-report-verification",
  "requirement": "Technical audit report provides complete, reproducible, and verifiable evidence trail.",
  "verificationCycle": 1,
  "kind": "COMMAND_EXECUTION",
  "argv": [
    "node",
    "-e",
    "require(\"node:fs\").accessSync(\"poc/reports/poc-20260826-real-execution-technical-audit.md\")"
  ],
  "cwd": "/Users/cassio/Documents/github/forgeloop",
  "resolution": {
    "resolutionMode": "LOCAL_EXECUTABLE",
    "mayInstall": false,
    "installer": null,
    "tool": null
  },
  "startedAt": "2026-08-26T18:01:42.065Z",
  "finishedAt": "2026-08-26T18:01:42.099Z",
  "status": "passed",
  "exitCode": 0,
  "durationMs": 34,
  "termination": "exit",
  "signal": null,
  "stdoutSha256": "e3b0c44298fc1c149afbf4c8996fb92427ae41e4649b934ca495991b7852b855",
  "stderrSha256": "e3b0c44298fc1c149afbf4c8996fb92427ae41e4649b934ca495991b7852b855",
  "stdoutBytes": 0,
  "stderrBytes": 0,
  "outputTruncated": false
}
